id,paragraph,theme
319,"The Warsaw Treaty's organization was two-fold: the Political Consultative Committee handled political matters, and the Combined Command of Pact Armed Forces controlled the assigned multi-national forces, with headquarters in Warsaw, Poland. Furthermore, the Supreme Commander of the Unified Armed Forces of the Warsaw Treaty Organization which commands and controls all the military forces of the member countries was also a First Deputy Minister of Defense of the USSR, and the Chief of Combined Staff of the Unified Armed Forces of the Warsaw Treaty Organization was also a First Deputy Chief of the General Staff of the Armed Forces of the USSR. Therefore, although ostensibly an international collective security alliance, the USSR dominated the Warsaw Treaty armed forces.",Warsaw_Pact
320,"The strategy behind the formation of the Warsaw Pact was driven by the desire of the Soviet Union to dominate Central and Eastern Europe. This policy was driven by ideological and geostrategic reasons. Ideologically, the Soviet Union arrogated the right to define socialism and communism and act as the leader of the global socialist movement. A corollary to this idea was the necessity of intervention if a country appeared to be violating core socialist ideas and Communist Party functions, which was explicitly stated in the Brezhnev Doctrine. Geostrategic principles also drove the Soviet Union to prevent invasion of its territory by Western European powers.",Warsaw_Pact
321,"Before creation of Warsaw Pact, fearing Germany rearmed, Czechoslovak leadership sought to create security pact with East Germany and Poland. These states protested strongly against re-militarization of West Germany. The Warsaw Pact was primarily put in place as a consequence of the rearming of West Germany inside NATO. Soviet leaders, as many European countries in both western and eastern side, feared Germany being once again a military power as a direct threat and German militarism remained a fresh memory among Soviets and Eastern Europeans. As Soviet Union had already bilateral treaties with all of its eastern satellites, the Pact has been long considered 'superfluous', and because of the rushed way in which it was conceived, NATO officials labeled it as a 'cardboard castle'. Previously, in March 1954, the USSR, fearing the restoration of German Militarism in West Germany, requested admission to NATO.",Warsaw_Pact
322,"The Soviet request to join NATO arose in the aftermath of the Berlin Conference of January–February 1954. Soviet foreign minister Molotov made proposals to have Germany reunified and elections for a pan-German government, under conditions of withdrawal of the four powers armies and German neutrality, but all were refused by the other foreign ministers, Dulles (USA), Eden (UK) and Bidault (France). Proposals for the reunification of Germany were nothing new: earlier on 20 March 1952, talks about a German reunification, initiated by the socalled 'Stalin Note', ended after the United Kingdom, France, and the United States insisted that a unified Germany should not be neutral and should be free to join the European Defence Community and rearm. James Dunn (USA), who met in Paris with Eden, Adenauer and Robert Schuman (France), affirmed that ""the object should be to avoid discussion with the Russians and to press on the European Defense Community"". According to John Gaddis ""there was little inclination in Western capitals to explore this offer"" from USSR. While historian Rolf Steininger asserts that Adenauer's conviction that “neutralization means sovietization” was the main factor in the rejection of the soviet proposals, Adenauer also feared that unification might have resulted in the end of the CDU's dominance in the Bundestag.",Warsaw_Pact
323,"One month later, the proposed European Treaty was rejected not only by supporters of the EDC but also by western opponents of the European Defense Community (like French Gaullist leader Palewski) who perceived it as ""unacceptable in its present form because it excludes the USA from participation in the collective security system in Europe"". The Soviets then decided to make a new proposal to the governments of the USA, UK and France stating to accept the participation of the USA in the proposed General European Agreement. And considering that another argument deployed against the Soviet proposal was that it was perceived by western powers as ""directed against the North Atlantic Pact and its liquidation"", the Soviets decided to declare their ""readiness to examine jointly with other interested parties the question of the participation of the USSR in the North Atlantic bloc"", specifying that ""the admittance of the USA into the General European Agreement should not be conditional on the three western powers agreeing to the USSR joining the North Atlantic Pact"".",Warsaw_Pact
324,"Again all proposals, including the request to join NATO, were rejected by UK, US, and French governments shortly after. Emblematic was the position of British General Hastings Ismay, supporter of NATO expansion, who said that NATO ""must grow until the whole free world gets under one umbrella."" He opposed the request to join NATO made by the USSR in 1954 saying that ""the Soviet request to join NATO is like an unrepentant burglar requesting to join the police force"".",Warsaw_Pact
325,"In April 1954 Adenauer made his first visit to the USA meeting Nixon, Eisenhower and Dulles. Ratification of EDC was delaying but the US representatives made it clear to Adenauer that EDC would have to become a part of NATO.",Warsaw_Pact
326,"Memories of the Nazi occupation were still strong, and the rearmament of Germany was feared by France too. On 30 August 1954 French Parliament rejected the EDC, thus ensuring its failure and blocking a major objective of US policy towards Europe: to associate Germany militarily with the West. The US Department of State started to elaborate alternatives: Germany would be invited to join NATO or, in the case of French obstructionism, strategies to circumvent a French veto would be implemented in order to obtain a German rearmament outside NATO.",Warsaw_Pact
327,"On 23 October 1954 – only nine years after Allies (UK, USA and USSR) defeated Nazi Germany ending World War II in Europe – the admission of the Federal Republic of Germany to the North Atlantic Pact was finally decided. The incorporation of West Germany into the organization on 9 May 1955 was described as ""a decisive turning point in the history of our continent"" by Halvard Lange, Foreign Affairs Minister of Norway at the time. In November 1954, the USSR requested a new European Security Treaty, in order to make a final attempt to not have a remilitarized West Germany potentially opposed to the Soviet Union, with no success.",Warsaw_Pact
328,"On 14 May 1955, the USSR and other seven European countries ""reaffirming their desire for the establishment of a system of European collective security based on the participation of all European states irrespective of their social and political systems"" established the Warsaw Pact in response to the integration of the Federal Republic of Germany into NATO, declaring that: ""a remilitarized Western Germany and the integration of the latter in the North-Atlantic bloc [...] increase the danger of another war and constitutes a threat to the national security of the peaceable states; [...] in these circumstances the peaceable European states must take the necessary measures to safeguard their security"".",Warsaw_Pact
329,"One of the founding members, East Germany was allowed to re-arm by the Soviet Union and the National People's Army was established as the armed forces of the country to counter the rearmament of West Germany.",Warsaw_Pact
330,"The eight member countries of the Warsaw Pact pledged the mutual defense of any member who would be attacked. Relations among the treaty signatories were based upon mutual non-intervention in the internal affairs of the member countries, respect for national sovereignty, and political independence. However, almost all governments of those member states were indirectly controlled by the Soviet Union.",Warsaw_Pact
331,"In July 1963 the Mongolian People's Republic asked to join the Warsaw Pact under Article 9 of the treaty. For this purpose a special protocol should have been taken since the text of the treaty applied only to Europe. Due to the emerging Sino-Soviet split, Mongolia remained on observer status. Soviet stationing troops were agreed to stay in Mongolia from 1966.",Warsaw_Pact
332,"For 36 years, NATO and the Warsaw Pact never directly waged war against each other in Europe; the United States and the Soviet Union and their respective allies implemented strategic policies aimed at the containment of each other in Europe, while working and fighting for influence within the wider Cold War on the international stage.",Warsaw_Pact
333,"In 1956, following the declaration of the Imre Nagy government of withdrawal of Hungary from the Warsaw Pact, Soviet troops entered the country and removed the government. Soviet forces crushed the nationwide revolt, leading to the death of an estimated 2,500 Hungarian citizens.",Warsaw_Pact
334,"The multi-national Communist armed forces' sole joint action was the Warsaw Pact invasion of Czechoslovakia in August 1968. All member countries, with the exception of the Socialist Republic of Romania and the People's Republic of Albania participated in the invasion.",Warsaw_Pact
335,"On 25 February 1991, the Warsaw Pact was declared disbanded at a meeting of defense and foreign ministers from remaining Pact countries meeting in Hungary. On 1 July 1991, in Prague, the Czechoslovak President Václav Havel formally ended the 1955 Warsaw Treaty Organization of Friendship, Cooperation, and Mutual Assistance and so disestablished the Warsaw Treaty after 36 years of military alliance with the USSR. In fact, the treaty was de facto disbanded in December 1989 during the violent revolution in Romania, which toppled the communist government, without military intervention form other member states. The USSR disestablished itself in December 1991.",Warsaw_Pact
336,"On 12 March 1999, the Czech Republic, Hungary, and Poland joined NATO; Bulgaria, Estonia, Latvia, Lithuania, Romania, and Slovakia joined in March 2004; Albania joined on 1 April 2009.",Warsaw_Pact
337,"In November 2005, the Polish government opened its Warsaw Treaty archives to the Institute of National Remembrance, who published some 1,300 declassified documents in January 2006. Yet the Polish government reserved publication of 100 documents, pending their military declassification. Eventually, 30 of the reserved 100 documents were published; 70 remained secret, and unpublished. Among the documents published is the Warsaw Treaty's nuclear war plan, Seven Days to the River Rhine – a short, swift counter-attack capturing Austria, Denmark, Germany and Netherlands east of River Rhine, using nuclear weapons, in self-defense, after a NATO first strike. The plan originated as a 1979 field training exercise war game, and metamorphosed into official Warsaw Treaty battle doctrine, until the late 1980s – which is why the People's Republic of Poland was a nuclear weapons base, first, to 178, then, to 250 tactical-range rockets. Doctrinally, as a Soviet-style (offensive) battle plan, Seven Days to the River Rhine gave commanders few defensive-war strategies for fighting NATO in Warsaw Treaty territory.[citation needed]",Warsaw_Pact
338,"Consequently, Molotov, fearing that EDC would be directed in the future against the USSR therefore ""seeking to prevent the formation of groups of European States directed against other European States"", made a proposal for a General European Treaty on Collective Security in Europe ""open to all European States without regard as to their social systems"" which would have included the unified Germany (thus making the EDC – perceived by the USSR as a threat – unusable). But Eden, Dulles and Bidault opposed the proposal.",Warsaw_Pact
339,"Materialism is a form of philosophical monism which holds that matter is the fundamental substance in nature, and that all phenomena, including mental phenomena and consciousness, are identical with material interactions.",Materialism
340,"Materialism is closely related to physicalism, the view that all that exists is ultimately physical. Philosophical physicalism has evolved from materialism with the discoveries of the physical sciences to incorporate more sophisticated notions of physicality than mere ordinary matter, such as: spacetime, physical energies and forces, dark matter, and so on. Thus the term ""physicalism"" is preferred over ""materialism"" by some, while others use the terms as if they are synonymous.",Materialism
341,"Materialism belongs to the class of monist ontology. As such, it is different from ontological theories based on dualism or pluralism. For singular explanations of the phenomenal reality, materialism would be in contrast to idealism, neutral monism, and spiritualism.",Materialism
342,"Despite the large number of philosophical schools and subtle nuances between many, all philosophies are said to fall into one of two primary categories, which are defined in contrast to each other: Idealism, and materialism.[a] The basic proposition of these two categories pertains to the nature of reality, and the primary distinction between them is the way they answer two fundamental questions: ""what does reality consist of?"" and ""how does it originate?"" To idealists, spirit or mind or the objects of mind (ideas) are primary, and matter secondary. To materialists, matter is primary, and mind or spirit or ideas are secondary, the product of matter acting upon matter.",Materialism
343,"The materialist view is perhaps best understood in its opposition to the doctrines of immaterial substance applied to the mind historically, famously by René Descartes. However, by itself materialism says nothing about how material substance should be characterized. In practice, it is frequently assimilated to one variety of physicalism or another.",Materialism
344,"During the 19th century, Karl Marx and Friedrich Engels extended the concept of materialism to elaborate a materialist conception of history centered on the roughly empirical world of human activity (practice, including labor) and the institutions created, reproduced, or destroyed by that activity (see materialist conception of history). Later Marxists developed the notion of dialectical materialism which characterized later Marxist philosophy and method.",Materialism
345,"Materialism developed, possibly independently, in several geographically separated regions of Eurasia during what Karl Jaspers termed the Axial Age (approximately 800 to 200 BC).",Materialism
346,"In Ancient Indian philosophy, materialism developed around 600 BC with the works of Ajita Kesakambali, Payasi, Kanada, and the proponents of the Cārvāka school of philosophy. Kanada became one of the early proponents of atomism. The Nyaya–Vaisesika school (600 BC - 100 BC) developed one of the earliest forms of atomism, though their proofs of God and their positing that the consciousness was not material precludes labelling them as materialists. Buddhist atomism and the Jaina school continued the atomic tradition.",Materialism
347,"Materialism is often associated with reductionism, according to which the objects or phenomena individuated at one level of description, if they are genuine, must be explicable in terms of the objects or phenomena at some other level of description — typically, at a more reduced level. Non-reductive materialism explicitly rejects this notion, however, taking the material constitution of all particulars to be consistent with the existence of real objects, properties, or phenomena not explicable in the terms canonically used for the basic material constituents. Jerry Fodor influentially argues this view, according to which empirical laws and explanations in ""special sciences"" like psychology or geology are invisible from the perspective of basic physics. A lot of vigorous literature has grown up around the relation between these views.",Materialism
348,"Ancient Greek philosophers like Thales, Anaxagoras (ca. 500 BC – 428 BC), Epicurus and Democritus prefigure later materialists. The Latin poem De Rerum Natura by Lucretius (ca. 99 BC – ca. 55 BC) reflects the mechanistic philosophy of Democritus and Epicurus. According to this view, all that exists is matter and void, and all phenomena result from different motions and conglomerations of base material particles called ""atoms"" (literally: ""indivisibles""). De Rerum Natura provides mechanistic explanations for phenomena such as erosion, evaporation, wind, and sound. Famous principles like ""nothing can touch body but body"" first appeared in the works of Lucretius. Democritus and Epicurus however did not hold to a monist ontology since they held to the ontological separation of matter and space i.e. space being ""another kind"" of being, indicating that the definition of ""materialism"" is wider than given scope for in this article.",Materialism
349,"Later Indian materialist Jayaraashi Bhatta (6th century) in his work Tattvopaplavasimha (""The upsetting of all principles"") refuted the Nyaya Sutra epistemology. The materialistic Cārvāka philosophy appears to have died out some time after 1400. When Madhavacharya compiled Sarva-darśana-samgraha (a digest of all philosophies) in the 14th century, he had no Cārvāka/Lokāyata text to quote from, or even refer to.",Materialism
350,"In early 12th-century al-Andalus, the Arabian philosopher, Ibn Tufail (Abubacer), wrote discussions on materialism in his philosophical novel, Hayy ibn Yaqdhan (Philosophus Autodidactus), while vaguely foreshadowing the idea of a historical materialism.",Materialism
351,"The French cleric Pierre Gassendi (1592-1665) represented the materialist tradition in opposition to the attempts of René Descartes (1596-1650) to provide the natural sciences with dualist foundations. There followed the materialist and atheist abbé Jean Meslier (1664-1729), Julien Offray de La Mettrie, the German-French Paul-Henri Thiry Baron d'Holbach (1723-1789), the Encyclopedist Denis Diderot (1713-1784), and other French Enlightenment thinkers; as well as (in England) John ""Walking"" Stewart (1747-1822), whose insistence in seeing matter as endowed with a moral dimension had a major impact on the philosophical poetry of William Wordsworth (1770-1850).",Materialism
352,"Arthur Schopenhauer (1788-1860) wrote that ""...materialism is the philosophy of the subject who forgets to take account of himself"". He claimed that an observing subject can only know material objects through the mediation of the brain and its particular organization. That is, the brain itself is the ""determiner"" of how material objects will be experienced or perceived:",Materialism
353,"The German materialist and atheist anthropologist Ludwig Feuerbach would signal a new turn in materialism through his book, The Essence of Christianity (1841), which provided a humanist account of religion as the outward projection of man's inward nature. Feuerbach's materialism would later heavily influence Karl Marx.",Materialism
354,"Many current and recent philosophers—e.g., Daniel Dennett, Willard Van Orman Quine, Donald Davidson, and Jerry Fodor—operate within a broadly physicalist or materialist framework, producing rival accounts of how best to accommodate mind, including functionalism, anomalous monism, identity theory, and so on.",Materialism
355,"The nature and definition of matter - like other key concepts in science and philosophy - have occasioned much debate. Is there a single kind of matter (hyle) which everything is made of, or multiple kinds? Is matter a continuous substance capable of expressing multiple forms (hylomorphism), or a number of discrete, unchanging constituents (atomism)? Does it have intrinsic properties (substance theory), or is it lacking them (prima materia)?",Materialism
356,"One challenge to the traditional concept of matter as tangible ""stuff"" came with the rise of field physics in the 19th century. Relativity shows that matter and energy (including the spatially distributed energy of fields) are interchangeable. This enables the ontological view that energy is prima materia and matter is one of its forms. On the other hand, the Standard Model of Particle physics uses quantum field theory to describe all interactions. On this view it could be said that fields are prima materia and the energy is a property of the field.",Materialism
357,"According to the dominant cosmological model, the Lambda-CDM model, less than 5% of the universe's energy density is made up of the ""matter"" described by the Standard Model of Particle Physics, and the majority of the universe is composed of dark matter and dark energy - with little agreement amongst scientists about what these are made of.",Materialism
358,"With the advent of quantum physics, some scientists believed the concept of matter had merely changed, while others believed the conventional position could no longer be maintained. For instance Werner Heisenberg said ""The ontology of materialism rested upon the illusion that the kind of existence, the direct 'actuality' of the world around us, can be extrapolated into the atomic range. This extrapolation, however, is impossible... atoms are not things."" Likewise, some philosophers[which?] feel that these dichotomies necessitate a switch from materialism to physicalism. Others use the terms ""materialism"" and ""physicalism"" interchangeably.",Materialism
359,"Some modern day physicists and science writers—such as Paul Davies and John Gribbin—have argued that materialism has been disproven by certain scientific findings in physics, such as quantum mechanics and chaos theory. In 1991, Gribbin and Davies released their book The Matter Myth, the first chapter of which, ""The Death of Materialism"", contained the following passage:",Materialism
360,"Davies' and Gribbin's objections are shared by proponents of digital physics who view information rather than matter to be fundamental. Their objections were also shared by some founders of quantum theory, such as Max Planck, who wrote:",Materialism
361,"According to the Catholic Encyclopedia of 1907-1912, materialism, defined as ""a philosophical system which regards matter as the only reality in the world [...] denies the existence of God and the soul"". Materialism, in this view, therefore becomes incompatible with most world religions, including Christianity, Judaism, and Islam. In such a context one can conflate materialism with atheism. Most of Hinduism and transcendentalism regards all matter as an illusion called Maya, blinding humans from knowing ""the truth"". Maya is the limited, purely physical and mental reality in which our everyday consciousness has become entangled. Maya gets destroyed for a person when s/he perceives Brahman with transcendental knowledge.",Materialism
362,"In contrast, Joseph Smith, the founder of the Latter Day Saint movement, taught: ""There is no such thing as immaterial matter. All spirit is matter, but it is more fine or pure, and can only be discerned by purer eyes; We cannot see it; but when our bodies are purified we shall see that it is all matter."" This spirit element has always existed; it is co-eternal with God. It is also called ""intelligence"" or ""the light of truth"", which like all observable matter ""was not created or made, neither indeed can be"". Members of the Church of Jesus Christ of Latter-day Saints view the revelations of Joseph Smith as a restoration of original Christian doctrine, which they believe post-apostolic theologians began to corrupt in the centuries after Christ. The writings of many[quantify] of these theologians indicate a clear influence of Greek metaphysical philosophies such as Neoplatonism, which characterized divinity as an utterly simple, immaterial, formless, substance/essence (ousia) that transcended all that was physical. Despite strong opposition from many Christians, this metaphysical depiction of God eventually became incorporated into the doctrine of the Christian church, displacing the original Judeo-Christian concept of a physical, corporeal God who created humans in His image and likeness.",Materialism
363,"An argument for idealism, such as those of Hegel and Berkeley, is ipso facto an argument against materialism. Matter can be argued to be redundant, as in bundle theory, and mind-independent properties can in turn be reduced to subjective percepts. Berkeley presents an example of the latter by pointing out that it is impossible to gather direct evidence of matter, as there is no direct experience of matter; all that is experienced is perception, whether internal or external. As such, the existence of matter can only be assumed from the apparent (perceived) stability of perceptions; it finds absolutely no evidence in direct experience.",Materialism
364,"If matter and energy are seen as necessary to explain the physical world, but incapable of explaining mind, dualism results. Emergence, holism, and process philosophy seek to ameliorate the perceived shortcomings of traditional (especially mechanistic) materialism without abandoning materialism entirely.",Materialism
