id,paragraph,theme
947,"In 1862, paper money was issued without the backing of precious metals, due to the Civil War. Silver and gold coins continued to be issued and in 1878 the link between paper money and coins was reinstated. This disconnection from gold and silver backing also occurred during the War of 1812. The use of paper money not backed by precious metals had also occurred under the Articles of Confederation from 1777 to 1788. With no solid backing and being easily counterfeited, the continentals quickly lost their value, giving rise to the phrase ""not worth a continental"". This was a primary reason for the ""No state shall... make any thing but gold and silver coin a tender in payment of debts"" clause in article 1, section 10 of the United States Constitution.",United_States_dollar
948,"In February 2007, the U.S. Mint, under the Presidential $1 Coin Act of 2005, introduced a new $1 U.S. Presidential dollar coin. Based on the success of the ""50 State Quarters"" series, the new coin features a sequence of presidents in order of their inaugurations, starting with George Washington, on the obverse side. The reverse side features the Statue of Liberty. To allow for larger, more detailed portraits, the traditional inscriptions of ""E Pluribus Unum"", ""In God We Trust"", the year of minting or issuance, and the mint mark will be inscribed on the edge of the coin instead of the face. This feature, similar to the edge inscriptions seen on the British £1 coin, is not usually associated with U.S. coin designs. The inscription ""Liberty"" has been eliminated, with the Statue of Liberty serving as a sufficient replacement. In addition, due to the nature of U.S. coins, this will be the first time there will be circulating U.S. coins of different denominations with the same president featured on the obverse (heads) side (Lincoln/penny, Jefferson/nickel, Franklin D. Roosevelt/dime, Washington/quarter, Kennedy/half dollar, and Eisenhower/dollar). Another unusual fact about the new $1 coin is Grover Cleveland will have two coins with his portrait issued due to the fact he was the only U.S. President to be elected to two non-consecutive terms.",United_States_dollar
949,"When the Federal Reserve makes a purchase, it credits the seller's reserve account (with the Federal Reserve). This money is not transferred from any existing funds—it is at this point that the Federal Reserve has created new high-powered money. Commercial banks can freely withdraw in cash any excess reserves from their reserve account at the Federal Reserve. To fulfill those requests, the Federal Reserve places an order for printed money from the U.S. Treasury Department. The Treasury Department in turn sends these requests to the Bureau of Engraving and Printing (to print new dollar bills) and the Bureau of the Mint (to stamp the coins).",United_States_dollar
950,"The value of the U.S. dollar declined significantly during wartime, especially during the American Civil War, World War I, and World War II. The Federal Reserve, which was established in 1913, was designed to furnish an ""elastic"" currency subject to ""substantial changes of quantity over short periods"", which differed significantly from previous forms of high-powered money such as gold, national bank notes, and silver coins. Over the very long run, the prior gold standard kept prices stable—for instance, the price level and the value of the U.S. dollar in 1914 was not very different from the price level in the 1880s. The Federal Reserve initially succeeded in maintaining the value of the U.S. dollar and price stability, reversing the inflation caused by the First World War and stabilizing the value of the dollar during the 1920s, before presiding over a 30% deflation in U.S. prices in the 1930s.",United_States_dollar
951,"There is ongoing debate about whether central banks should target zero inflation (which would mean a constant value for the U.S. dollar over time) or low, stable inflation (which would mean a continuously but slowly declining value of the dollar over time, as is the case now). Although some economists are in favor of a zero inflation policy and therefore a constant value for the U.S. dollar, others contend that such a policy limits the ability of the central bank to control interest rates and stimulate the economy when needed.",United_States_dollar
952,"The word ""dollar"" is one of the words in the first paragraph of Section 9 of Article 1 of the U.S. Constitution. In that context, ""dollars"" is a reference to the Spanish milled dollar, a coin that had a monetary value of 8 Spanish units of currency, or reales. In 1792 the U.S. Congress adopted legislation titled An act establishing a mint, and regulating the Coins of the United States. Section 9 of that act authorized the production of various coins, including ""DOLLARS OR UNITS—each to be of the value of a Spanish milled dollar as the same is now current, and to contain three hundred and seventy-one grains and four sixteenth parts of a grain of pure, or four hundred and sixteen grains of standard silver"". Section 20 of the act provided, ""That the money of account of the United States shall be expressed in dollars, or units... and that all accounts in the public offices and all proceedings in the courts of the United States shall be kept and had in conformity to this regulation"". In other words, this act designated the United States dollar as the unit of currency of the United States.",United_States_dollar
953,"A ""grand"", sometimes shortened to simply ""G"", is a common term for the amount of $1,000. The suffix ""K"" or ""k"" (from ""kilo-"") is also commonly used to denote this amount (such as ""$10k"" to mean $10,000). However, the $1,000 note is no longer in general use. A ""large"" or ""stack"", it is usually a reference to a multiple of $1,000 (such as ""fifty large"" meaning $50,000). The $100 note is nicknamed ""Benjamin"", ""Benji"", ""Ben"", or ""Franklin"" (after Benjamin Franklin), ""C-note"" (C being the Roman numeral for 100), ""Century note"" or ""bill"" (e.g. ""two bills"" being $200). The $50 note is occasionally called a ""yardstick"" or a ""grant"" (after President Ulysses S. Grant, pictured on the obverse). The $20 note is referred to as a ""double sawbuck"", ""Jackson"" (after Andrew Jackson), or ""double eagle"". The $10 note is referred to as a ""sawbuck"", ""ten-spot"" or ""Hamilton"" (after Alexander Hamilton). The $5 note as ""Lincoln"", ""fin"", ""fiver"" or ""five-spot"". The infrequently-used $2 note is sometimes called ""deuce"", ""Tom"", or ""Jefferson"" (after Thomas Jefferson). The $1 note as a ""single"" or ""buck"". The dollar has also been, referred to as a ""bone"" and ""bones"" in plural (e.g. ""twenty bones"" is equal to $20). The newer designs, with portraits displayed in the main body of the obverse rather than in cameo insets upon paper color-coded by denomination, are sometimes referred to as ""bigface"" notes or ""Monopoly money"".",United_States_dollar
954,"The U.S. dollar was created by the Constitution and defined by the Coinage Act of 1792. It specified a ""dollar"" to be based in the Spanish milled dollar and of 371 grains and 4 sixteenths part of a grain of pure or 416 grains (27.0 g) of standard silver and an ""eagle"" to be 247 and 4 eighths of a grain or 270 grains (17 g) of gold (again depending on purity). The choice of the value 371 grains arose from Alexander Hamilton's decision to base the new American unit on the average weight of a selection of worn Spanish dollars. Hamilton got the treasury to weigh a sample of Spanish dollars and the average weight came out to be 371 grains. A new Spanish dollar was usually about 377 grains in weight, and so the new U.S. dollar was at a slight discount in relation to the Spanish dollar.",United_States_dollar
955,"The United States Mint produces Proof Sets specifically for collectors and speculators. Silver Proofs tend to be the standard designs but with the dime, quarter, and half dollar containing 90% silver. Starting in 1983 and ending in 1997, the Mint also produced proof sets containing the year's commemorative coins alongside the regular coins. Another type of proof set is the Presidential Dollar Proof Set where four special $1 coins are minted each year featuring a president. Because of budget constraints and increasing stockpiles of these relatively unpopular coins, the production of new Presidential dollar coins for circulation was suspended on December 13, 2011, by U.S. Treasury Secretary Timothy F. Geithner. Future minting of such coins will be made solely for collectors.",United_States_dollar
956,"The Constitution provides that ""a regular Statement and Account of the Receipts and Expenditures of all public Money shall be published from time to time"". That provision of the Constitution is made specific by Section 331 of Title 31 of the United States Code. The sums of money reported in the ""Statements"" are currently being expressed in U.S. dollars (for example, see the 2009 Financial Report of the United States Government). The U.S. dollar may therefore be described as the unit of account of the United States.",United_States_dollar
957,"Currently printed denominations are $1, $2, $5, $10, $20, $50, and $100. Notes above the $100 denomination stopped being printed in 1946 and were officially withdrawn from circulation in 1969. These notes were used primarily in inter-bank transactions or by organized crime; it was the latter usage that prompted President Richard Nixon to issue an executive order in 1969 halting their use. With the advent of electronic banking, they became less necessary. Notes in denominations of $500, $1,000, $5,000, $10,000 and $100,000 were all produced at one time; see large denomination bills in U.S. currency for details. These notes are now collectors' items and are worth more than their face value to collectors.",United_States_dollar
958,"The colloquialism ""buck""(s) (much like the British word ""quid""(s, pl) for the pound sterling) is often used to refer to dollars of various nations, including the U.S. dollar. This term, dating to the 18th century, may have originated with the colonial leather trade. It may also have originated from a poker term. ""Greenback"" is another nickname originally applied specifically to the 19th century Demand Note dollars created by Abraham Lincoln to finance the costs of the Civil War for the North. The original note was printed in black and green on the back side. It is still used to refer to the U.S. dollar (but not to the dollars of other countries). Other well-known names of the dollar as a whole in denominations include ""greenmail"", ""green"" and ""dead presidents"" (the last because deceased presidents are pictured on most bills).",United_States_dollar
959,"The value of the U.S. dollar was therefore no longer anchored to gold, and it fell upon the Federal Reserve to maintain the value of the U.S. currency. The Federal Reserve, however, continued to increase the money supply, resulting in stagflation and a rapidly declining value of the U.S. dollar in the 1970s. This was largely due to the prevailing economic view at the time that inflation and real economic growth were linked (the Phillips curve), and so inflation was regarded as relatively benign. Between 1965 and 1981, the U.S. dollar lost two thirds of its value.",United_States_dollar
960,"The dollar was first based on the value and look of the Spanish dollar, used widely in Spanish America from the 16th to the 19th centuries. The first dollar coins issued by the United States Mint (founded 1792) were similar in size and composition to the Spanish dollar, minted in Mexico and Peru. The Spanish, U.S. silver dollars, and later, Mexican silver pesos circulated side by side in the United States, and the Spanish dollar and Mexican peso remained legal tender until the Coinage Act of 1857. The coinage of various English colonies also circulated. The lion dollar was popular in the Dutch New Netherland Colony (New York), but the lion dollar also circulated throughout the English colonies during the 17th century and early 18th century. Examples circulating in the colonies were usually worn so that the design was not fully distinguishable, thus they were sometimes referred to as ""dog dollars"".",United_States_dollar
961,"The Gold Standard Act of 1900 abandoned the bimetallic standard and defined the dollar as 23.22 grains (1.505 g) of gold, equivalent to setting the price of 1 troy ounce of gold at $20.67. Silver coins continued to be issued for circulation until 1964, when all silver was removed from dimes and quarters, and the half dollar was reduced to 40% silver. Silver half dollars were last issued for circulation in 1970. Gold coins were confiscated by Executive Order 6102 issued in 1933 by Franklin Roosevelt. The gold standard was changed to 13.71 grains (0.888 g), equivalent to setting the price of 1 troy ounce of gold at $35. This standard persisted until 1968.",United_States_dollar
962,"Early releases of the Washington coin included error coins shipped primarily from the Philadelphia mint to Florida and Tennessee banks. Highly sought after by collectors, and trading for as much as $850 each within a week of discovery, the error coins were identified by the absence of the edge impressions ""E PLURIBUS UNUM IN GOD WE TRUST 2007 P"". The mint of origin is generally accepted to be mostly Philadelphia, although identifying the source mint is impossible without opening a mint pack also containing marked units. Edge lettering is minted in both orientations with respect to ""heads"", some amateur collectors were initially duped into buying ""upside down lettering error"" coins. Some cynics also erroneously point out that the Federal Reserve makes more profit from dollar bills than dollar coins because they wear out in a few years, whereas coins are more permanent. The fallacy of this argument arises because new notes printed to replace worn out notes, which have been withdrawn from circulation, bring in no net revenue to the government to offset the costs of printing new notes and destroying the old ones. As most vending machines are incapable of making change in banknotes, they commonly accept only $1 bills, though a few will give change in dollar coins.",United_States_dollar
963,"The U.S. Constitution provides that Congress shall have the power to ""borrow money on the credit of the United States"". Congress has exercised that power by authorizing Federal Reserve Banks to issue Federal Reserve Notes. Those notes are ""obligations of the United States"" and ""shall be redeemed in lawful money on demand at the Treasury Department of the United States, in the city of Washington, District of Columbia, or at any Federal Reserve bank"". Federal Reserve Notes are designated by law as ""legal tender"" for the payment of debts. Congress has also authorized the issuance of more than 10 other types of banknotes, including the United States Note and the Federal Reserve Bank Note. The Federal Reserve Note is the only type that remains in circulation since the 1970s.",United_States_dollar
964,"Usually, the short-term goal of open market operations is to achieve a specific short-term interest rate target. In other instances, monetary policy might instead entail the targeting of a specific exchange rate relative to some foreign currency or else relative to gold. For example, in the case of the United States the Federal Reserve targets the federal funds rate, the rate at which member banks lend to one another overnight. The other primary means of conducting monetary policy include: (i) Discount window lending (as lender of last resort); (ii) Fractional deposit lending (changes in the reserve requirement); (iii) Moral suasion (cajoling certain market players to achieve specified outcomes); (iv) ""Open mouth operations"" (talking monetary policy with the market).",United_States_dollar
965,"Under the Bretton Woods system established after World War II, the value of gold was fixed to $35 per ounce, and the value of the U.S. dollar was thus anchored to the value of gold. Rising government spending in the 1960s, however, led to doubts about the ability of the United States to maintain this convertibility, gold stocks dwindled as banks and international investors began to convert dollars to gold, and as a result the value of the dollar began to decline. Facing an emerging currency crisis and the imminent danger that the United States would no longer be able to redeem dollars for gold, gold convertibility was finally terminated in 1971 by President Nixon, resulting in the ""Nixon shock"".",United_States_dollar
966,"The U.S. dollar is fiat money. It is the currency most used in international transactions and is the world's most dominant reserve currency. Several countries use it as their official currency, and in many others it is the de facto currency. Besides the United States, it is also used as the sole currency in two British Overseas Territories in the Caribbean: the British Virgin Islands and the Turks and Caicos islands. A few countries use only the U.S. Dollar for paper money, while the country mints its own coins, or also accepts U.S. coins that can be used as payment in U.S. dollars, such as the Susan B. Anthony dollar.",United_States_dollar
967,"Today, USD notes are made from cotton fiber paper, unlike most common paper, which is made of wood fiber. U.S. coins are produced by the United States Mint. U.S. dollar banknotes are printed by the Bureau of Engraving and Printing and, since 1914, have been issued by the Federal Reserve. The ""large-sized notes"" issued before 1928 measured 7.42 inches (188 mm) by 3.125 inches (79.4 mm); small-sized notes, introduced that year, measure 6.14 inches (156 mm) by 2.61 inches (66 mm) by 0.0043 inches (0.11 mm). When the current, smaller sized U.S. currency was introduced it was referred to as Philippine-sized currency because the Philippines had previously adopted the same size for its legal currency.",United_States_dollar
968,"From 1792, when the Mint Act was passed, the dollar was defined as 371.25 grains (24.056 g) of silver. Many historians[who?] erroneously assume gold was standardized at a fixed rate in parity with silver; however, there is no evidence of Congress making this law. This has to do with Alexander Hamilton's suggestion to Congress of a fixed 15:1 ratio of silver to gold, respectively. The gold coins that were minted however, were not given any denomination whatsoever and traded for a market value relative to the Congressional standard of the silver dollar. 1834 saw a shift in the gold standard to 23.2 grains (1.50 g), followed by a slight adjustment to 23.22 grains (1.505 g) in 1837 (16:1 ratio).[citation needed]",United_States_dollar
969,"Technically, all these coins are still legal tender at face value, though some are far more valuable today for their numismatic value, and for gold and silver coins, their precious metal value. From 1965 to 1970 the Kennedy half dollar was the only circulating coin with any silver content, which was removed in 1971 and replaced with cupronickel. However, since 1992, the U.S. Mint has produced special Silver Proof Sets in addition to the regular yearly proof sets with silver dimes, quarters, and half dollars in place of the standard copper-nickel versions. In addition, an experimental $4.00 (Stella) coin was also minted in 1879, but never placed into circulation, and is properly considered to be a pattern rather than an actual coin denomination.",United_States_dollar
970,"Dollar coins have not been very popular in the United States. Silver dollars were minted intermittently from 1794 through 1935; a copper-nickel dollar of the same large size, featuring President Dwight D. Eisenhower, was minted from 1971 through 1978. Gold dollars were also minted in the 19th century. The Susan B. Anthony dollar coin was introduced in 1979; these proved to be unpopular because they were often mistaken for quarters, due to their nearly equal size, their milled edge, and their similar color. Minting of these dollars for circulation was suspended in 1980 (collectors' pieces were struck in 1981), but, as with all past U.S. coins, they remain legal tender. As the number of Anthony dollars held by the Federal Reserve and dispensed primarily to make change in postal and transit vending machines had been virtually exhausted, additional Anthony dollars were struck in 1999. In 2000, a new $1 coin, featuring Sacagawea, (the Sacagawea dollar) was introduced, which corrected some of the problems of the Anthony dollar by having a smooth edge and a gold color, without requiring changes to vending machines that accept the Anthony dollar. However, this new coin has failed to achieve the popularity of the still-existing $1 bill and is rarely used in daily transactions. The failure to simultaneously withdraw the dollar bill and weak publicity efforts have been cited by coin proponents as primary reasons for the failure of the dollar coin to gain popular support.",United_States_dollar
971,"The monetary base consists of coins and Federal Reserve Notes in circulation outside the Federal Reserve Banks and the U.S. Treasury, plus deposits held by depository institutions at Federal Reserve Banks. The adjusted monetary base has increased from approximately 400 billion dollars in 1994, to 800 billion in 2005, and over 3000 billion in 2013. The amount of cash in circulation is increased (or decreased) by the actions of the Federal Reserve System. Eight times a year, the 12-person Federal Open Market Committee meet to determine U.S. monetary policy. Every business day, the Federal Reserve System engages in Open market operations to carry out that monetary policy. If the Federal Reserve desires to increase the money supply, it will buy securities (such as U.S. Treasury Bonds) anonymously from banks in exchange for dollars. Conversely, it will sell securities to the banks in exchange for dollars, to take dollars out of circulation.",United_States_dollar
972,"The decline in the value of the U.S. dollar corresponds to price inflation, which is a rise in the general level of prices of goods and services in an economy over a period of time. A consumer price index (CPI) is a measure estimating the average price of consumer goods and services purchased by households. The United States Consumer Price Index, published by the Bureau of Labor Statistics, is a measure estimating the average price of consumer goods and services in the United States. It reflects inflation as experienced by consumers in their day-to-day living expenses. A graph showing the U.S. CPI relative to 1982–1984 and the annual year-over-year change in CPI is shown at right.",United_States_dollar
973,"Everton were founder members of the Premier League in 1992, but struggled to find the right manager. Howard Kendall had returned in 1990 but could not repeat his previous success, while his successor, Mike Walker, was statistically the least successful Everton manager to date. When former Everton player Joe Royle took over in 1994 the club's form started to improve; his first game in charge was a 2–0 victory over derby rivals Liverpool. Royle dragged Everton clear of relegation, leading the club to the FA Cup for the fifth time in its history, defeating Manchester United 1–0 in the final.",Everton_F.C.
974,"The Tower has been inextricably linked with the Everton area since its construction in 1787. It was originally used as a bridewell to incarcerate mainly drunks and minor criminals, and it still stands today on Everton Brow in Netherfield Road. The tower was accompanied by two laurel wreaths on either side and, according to the College of Arms in London, Kelly chose to include the laurels as they were the sign of winners. The crest was accompanied by the club motto, ""Nil Satis Nisi Optimum"", meaning ""Nothing but the best is good enough"".",Everton_F.C.
975,"On matchdays, in a tradition going back to 1962, players walk out to the theme tune to Z-Cars, named ""Johnny Todd"", a traditional Liverpool children's song collected in 1890 by Frank Kidson which tells the story of a sailor betrayed by his lover while away at sea, although on two separate occasions in the 1994, they ran out to different songs. In August 1994, the club played 2 Unlimited's song ""Get Ready For This"", and a month later, a reworking of the Creedence Clearwater Revival classic ""Bad Moon Rising"". Both were met with complete disapproval by Everton fans.",Everton_F.C.
976,"Everton hold the record for the most seasons in England's top tier (Division One/Premier League), at 111 seasons out of 114 as of 2014–15 (the club played in Division 2 in 1930–31 and from 1951–54). They are one of seven teams to have played all 22 seasons of the Premier League since its inception in August 1992 – the others being Arsenal, Aston Villa, Chelsea, Liverpool, Manchester United, and Tottenham Hotspur. Everton against Aston Villa is the most played fixture in England's top flight, as of the 2012–13 season the two founder members of the Football League have played a record 196 league games.",Everton_F.C.
977,"Formed in 1878, Everton were founding members of The Football League in 1888 and won their first league championship two seasons later. Following four league titles and two FA Cup wins, Everton experienced a lull in the immediate post World War Two period until a revival in the 1960s which saw the club win two league championships and an FA Cup. The mid-1980s represented their most recent period of sustained success, with two League Championship successes, an FA Cup, and the 1985 European Cup Winners' Cup. The club's most recent major trophy was the 1995 FA Cup. The club's supporters are known as Evertonians.",Everton_F.C.
