id,paragraph,theme
674,"At present, the full name of the government of Nanjing is ""People's Government of Nanjing City"" and the city is under the one-party rule of the CPC, with the CPC Nanjing Committee Secretary as the de facto governor of the city and the mayor as the executive head of the government working under the secretary.",Nanjing
675,"According to the Sixth China Census, the total population of the City of Nanjing reached 8.005 million in 2010. The statistics in 2011 estimated the total population to be 8.11 million. The birth rate was 8.86 percent and the death rate was 6.88 percent. The urban area had a population of 6.47 million people. The sex ratio of the city population was 107.31 males to 100 females.",Nanjing
676,"As in most of eastern China the ethnic makeup of Nanjing is predominantly Han nationality (98.56 percent), with 50 other minority nationalities. In 1999, 77,394 residents belonged to minority nationalities, among which the vast majority (64,832) were Hui nationalities, contributing 83.76 percent to the minority population. The second and third largest minority groups were Manchu (2,311) and Zhuang (533) nationalities. Most of the minority nationalities resided in Jianye District, comprising 9.13 percent of the district's population.",Nanjing
677,"Since the Three Kingdoms period, Nanjing has been an industrial centre for textiles and minting owing to its strategic geographical location and convenient transportation. During the Ming dynasty, Nanjing's industry was further expanded, and the city became one of the most prosperous cities in China and the world. It led in textiles, minting, printing, shipbuilding and many other industries, and was the busiest business center in East Asia. Textiles boomed particularly in Qing dynasty, the industry created around 200 thousand jobs and there were about 50 thousand satin machines in the city in 18th and 19th century.",Nanjing
678,"Into the first half of the twentieth century after the establishment of ROC, Nanjing gradually shifted from being a production hub towards being a heavy consumption city, mainly because of the rapid expansion of its wealthy population after Nanjing once again regained the political spotlight of China. A number of huge department stores such as Zhongyang Shangchang sprouted up, attracting merchants from all over China to sell their products in Nanjing. In 1933, the revenue generated by the food and entertainment industry in the city exceeded the sum of the output of the manufacturing and agriculture industry. One third of the city population worked in the service industry, .",Nanjing
679,"In the 1950s after PRC was established by CPC, the government invested heavily in the city to build a series of state-owned heavy industries, as part of the national plan of rapid industrialization, converting it into a heavy industry production centre of East China. Overenthusiastic in building a “world-class” industrial city, the government also made many disastrous mistakes during development, such as spending hundreds of millions of yuan to mine for non-existent coal, resulting in negative economic growth in the late 1960s. From 1960s to 1980s there were Five Pillar Industries, namely, electronics, cars, petrochemical, iron and steel, and power, each with big state-owned firms. After the Reform and Opening recovering market economy, the state-owned enterprises found themselves incapable of competing with efficient multinational firms and local private firms, hence were either mired in heavy debt or forced into bankruptcy or privatization and this resulted in large numbers of layoff workers who were technically not unemployed but effectively jobless.",Nanjing
680,"The current economy of the city is basically newly developed based on the past. Service industries are dominating, accounting for about 60 percent of the GDP of the city, and financial industry, culture industry and tourism industry are top 3 of them. Industries of information technology, energy saving and environmental protection, new energy, smart power grid and intelligent equipment manufacturing have become pillar industries. Big private firms include Suning, Yurun, Sanpower, Fuzhong, Hiteker, 5stars, Jinpu, Tiandi, CTTQ Pharmaceutical and Simcere Pharmaceutical. Big state-owned firms include Panda Electronics, Yangzi Petrochemical, Jinling Petrochemical, Nanjing Chemical, Nanjing Steel, Jincheng Motors, Jinling Pharmaceutical, Chenguang and NARI. The city has also attracted foreign investment, multinational firms such as Siemens, Ericsson, Volkswagen, Iveco, A.O. Smith, and Sharp have established their lines, and a number of multinationals such as Ford, IBM, Lucent, Samsung and SAP established research center there. Many China-based leading firms such as Huawei, ZTE and Lenovo have key R & D institutes in the city. Nanjing is an industrial technology research and development hub, hosting many R & D centers and institutions, especially in areas of electronics technology, information technology, computer software, biotechnology and pharmaceutical technology and new material technology.",Nanjing
681,"In recent years, Nanjing has been developing its economy, commerce, industry, as well as city construction. In 2013 the city's GDP was RMB 801 billion (3rd in Jiangsu), and GDP per capita(current price) was RMB 98,174(US$16041), a 11 percent increase from 2012. The average urban resident's disposable income was RMB 36,200, while the average rural resident's net income was RMB 14,513. The registered urban unemployment rate was 3.02 percent, lower than the national average (4.3 percent). Nanjing's Gross Domestic Product ranked 12th in 2013 in China, and its overall competence ranked 6th in mainland and 8th including Taiwan and Hong Kong in 2009.",Nanjing
682,"Nanjing is the transportation hub in eastern China and the downstream Yangtze River area. Different means of transportation constitute a three-dimensional transport system that includes land, water and air. As in most other Chinese cities, public transportation is the dominant mode of travel of the majority of the citizens. As of October 2014, Nanjing had five bridges and two tunnels over the Yangtze River, which are tying districts north of the river with the city centre on the south bank.",Nanjing
683,"Nanjing is an important railway hub in eastern China. It serves as rail junction for the Beijing-Shanghai (Jinghu) (which is itself composed of the old Jinpu and Huning Railways), Nanjing–Tongling Railway (Ningtong), Nanjing–Qidong (Ningqi), and the Nanjing-Xian (Ningxi) which encompasses the Hefei–Nanjing Railway. Nanjing is connected to the national high-speed railway network by Beijing–Shanghai High-Speed Railway and Shanghai–Wuhan–Chengdu Passenger Dedicated Line, with several more high-speed rail lines under construction.",Nanjing
684,"Among all 17 railway stations in Nanjing, passenger rail service is mainly provided by Nanjing Railway Station and Nanjing South Railway Station, while other stations like Nanjing West Railway Station, Zhonghuamen Railway Station and Xianlin Railway Station serve minor roles. Nanjing Railway Station was first built in 1968. In 1999, On November 12, 1999, the station was burnt in a serious fire. Reconstruction of the station was finished on September 1, 2005. Nanjing South Railway Station, which is one of the 5 hub stations on Beijing–Shanghai High-Speed Railway, has officially been claimed as the largest railway station in Asia and the second largest in the world in terms of GFA (Gross Floor Area). Construction of Nanjing South Station began on 10 January 2008. The station was opened for public service in 2011.",Nanjing
685,"Express highways such as Hu–Ning, Ning–He, Ning–Hang enable commuters to travel to Shanghai, Hefei, Hangzhou, and other important cities quickly and conveniently. Inside the city of Nanjing, there are 230 km (140 mi) of highways, with a highway coverage density of 3.38 kilometres per hundred square kilometrs (5.44 mi/100 sq mi). The total road coverage density of the city is 112.56 kilometres per hundred square kilometres (181.15 mi/100 sq mi). The two artery roads in Nanjing are Zhongshan Road and Hanzhong. The two roads cross in the city centre, Xinjiekou.",Nanjing
686,"The city also boasts an efficient network of public transportation, which mainly consists of bus, taxi and metro systems. The bus network, which is currently run by three companies since 2011, provides more than 370 routes covering all parts of the city and suburban areas. Nanjing Metro Line 1, started service on September 3, 2005, with 16 stations and a length of 21.72 km. Line 2 and the 24.5 km-long south extension of Line 1 officially opened to passenger service on May 28, 2010. At present, Nanjing has a metro system with a grand total of 223.6 kilometers (138.9 mi) of route and 121 stations. They are Line 1, Line 2, Line 3, Line 10, Line S1 and Line S8. The city is planning to complete a 17-line Metro and light-rail system by 2030. The expansion of the Metro network will greatly facilitate the intracity transportation and reduce the currently heavy traffic congestion.",Nanjing
687,"Nanjing's airport, Lukou International Airport, serves both national and international flights. In 2013, Nanjing airport handled 15,011,792 passengers and 255,788.6 tonnes of freight. The airport currently has 85 routes to national and international destinations, which include Japan, Korea, Thailand, Malaysia, Singapore, USA and Germany. The airport is connected by a 29-kilometre (18 mi) highway directly to the city center, and is also linked to various intercity highways, making it accessible to the passengers from the surrounding cities. A railway Ninggao Intercity Line is being built to link the airport with Nanjing South Railway Station. Lukou Airport was opened on 28 June 1997, replacing Nanjing Dajiaochang Airport as the main airport serving Nanjing. Dajiaochang Airport is still used as a military air base.",Nanjing
688,"Port of Nanjing is the largest inland port in China, with annual cargo tonnage reached 191,970,000 t in 2012. The port area is 98 kilometres (61 mi) in length and has 64 berths including 16 berths for ships with a tonnage of more than 10,000. Nanjing is also the biggest container port along the Yangtze River; in March 2004, the one million container-capacity base, Longtan Containers Port Area opened, further consolidating Nanjing as the leading port in the region. As of 2010, it operated six public ports and three industrial ports.",Nanjing
689,"In the 1960s, the first Nanjing Yangtze River Bridge was completed, and served as the only bridge crossing over the Lower Yangtze in eastern China at that time. The bridge was a source of pride and an important symbol of modern China, having been built and designed by the Chinese themselves following failed surveys by other nations and the reliance on and then rejection of Soviet expertise. Begun in 1960 and opened to traffic in 1968, the bridge is a two-tiered road and rail design spanning 4,600 metres on the upper deck, with approximately 1,580 metres spanning the river itself. Since then four more bridges and two tunnels have been built. Going in the downstream direction, the Yangtze crossings in Nanjing are: Dashengguan Bridge, Line 10 Metro Tunnel, Third Bridge, Nanjing Yangtze River Tunnel, First Bridge, Second Bridge and Fourth Bridge.",Nanjing
690,"Being one of the four ancient capitals of China, Nanjing has always been a cultural centre attracting intellectuals from all over the country. In the Tang and Song dynasties, Nanjing was a place where poets gathered and composed poems reminiscent of its luxurious past; during the Ming and Qing dynasties, the city was the official imperial examination centre (Jiangnan Examination Hall) for the Jiangnan region, again acting as a hub where different thoughts and opinions converged and thrived.",Nanjing
691,"Today, with a long cultural tradition and strong support from local educational institutions, Nanjing is commonly viewed as a “city of culture” and one of the more pleasant cities to live in China.",Nanjing
692,"Some of the leading art groups of China are based in Nanjing; they include the Qianxian Dance Company, Nanjing Dance Company, Jiangsu Peking Opera Institute and Nanjing Xiaohonghua Art Company among others.",Nanjing
693,"Jiangsu Province Kun Opera is one of the best theatres for Kunqu, China's oldest stage art. It is considered a conservative and traditional troupe. Nanjing also has professional opera troupes for the Yang, Yue (shaoxing), Xi and Jing (Chinese opera varieties) as well as Suzhou pingtan, spoken theatre and puppet theatre.",Nanjing
694,"Jiangsu Art Gallery is the largest gallery in Jiangsu Province, presenting some of the best traditional and contemporary art pieces of China; many other smaller-scale galleries, such as Red Chamber Art Garden and Jinling Stone Gallery, also have their own special exhibitions.",Nanjing
695,"Many traditional festivals and customs were observed in the old times, which included climbing the City Wall on January 16, bathing in Qing Xi on March 3, hill hiking on September 9 and others (the dates are in Chinese lunar calendar). Almost none of them, however, are still celebrated by modern Nanjingese.",Nanjing
696,"Instead, Nanjing, as a popular tourist destination, hosts a series of government-organised events throughout the year. The annual International Plum Blossom Festival held in Plum Blossom Hill, the largest plum collection in China, attracts thousands of tourists both domestically and internationally. Other events include Nanjing Baima Peach Blossom and Kite Festival, Jiangxin Zhou Fruit Festival and Linggu Temple Sweet Osmanthus Festival.",Nanjing
697,"Nanjing Library, founded in 1907, houses more than 10 million volumes of printed materials and is the third largest library in China, after the National Library in Beijing and Shanghai Library. Other libraries, such as city-owned Jinling Library and various district libraries, also provide considerable amount of information to citizens. Nanjing University Library is the second largest university libraries in China after Peking University Library, and the fifth largest nationwide, especially in the number of precious collections.",Nanjing
698,"Nanjing has some of the oldest and finest museums in China. Nanjing Museum, formerly known as National Central Museum during ROC period, is the first modern museum and remains as one of the leading museums in China having 400,000 items in its permanent collection,. The museum is notable for enormous collections of Ming and Qing imperial porcelain, which is among the largest in the world. Other museums include the City Museum of Nanjing in the Chaotian Palace, the Oriental Metropolitan Museum, the China Modern History Museum in the Presidential Palace, the Nanjing Massacre Memorial Hall, the Taiping Kingdom History Museum, Jiangning Imperial Silk Manufacturing Museum, Nanjing Yunjin Museum, Nanjing City Wall Cultural Museum, Nanjing Customs Museum in Ganxi House, Nanjing Astronomical History Museum, Nanjing Paleontological Museum, Nanjing Geological Museum, Nanjing Riverstones Museum, and other museums and memorials such Zheng He Memorial, Jinling Four Modern Calligraphers Memorial.",Nanjing
699,"Most of Nanjing's major theatres are multi-purpose, used as convention halls, cinemas, musical halls and theatres on different occasions. The major theatres include the People's Convention Hall and the Nanjing Arts and Culture Center. The Capital Theatre well known in the past is now a museum in theatre/film.",Nanjing
700,"Traditionally Nanjing's nightlife was mostly centered around Nanjing Fuzimiao (Confucius Temple) area along the Qinhuai River, where night markets, restaurants and pubs thrived. Boating at night in the river was a main attraction of the city. Thus, one can see the statues of the famous teachers and educators of the past not too far from those of the courtesans who educated the young men in the other arts.",Nanjing
701,"In the past 20 years, several commercial streets have been developed, hence the nightlife has become more diverse: there are shopping malls opening late in the Xinjiekou CBD and Hunan Road. The well-established ""Nanjing 1912"" district hosts a wide variety of recreational facilities ranging from traditional restaurants and western pubs to dance clubs. There are two major areas where bars are densely located; one is in 1912 block; the other is along Shanghai road and its neighbourhood. Both are popular with international residents of the city.",Nanjing
702,"The radish is also a typical food representing people of Nanjing, which has been spread through word of mouth as an interesting fact for many years in China. According to Nanjing.GOV.cn, ""There is a long history of growing radish in Nanjing especially the southern suburb. In the spring, the radish tastes very juicy and sweet. It is well-known that people in Nanjing like eating radish. And the people are even addressed as 'Nanjing big radish', which means they are unsophisticated, passionate and conservative. From health perspective, eating radish can help to offset the stodgy food that people take during the Spring Festival"".",Nanjing
703,"As a major Chinese city, Nanjing is home to many professional sports teams. Jiangsu Sainty, the football club currently staying in Chinese Super League, is a long-term tenant of Nanjing Olympic Sports Center. Jiangsu Nangang Basketball Club is a competitive team which has long been one of the major clubs fighting for the title in China top level league, CBA. Jiangsu Volleyball men and women teams are also traditionally considered as at top level in China volleyball league.",Nanjing
704,"There are two major sports centers in Nanjing, Wutaishan Sports Center and Nanjing Olympic Sports Center. Both of these two are comprehensive sports centers, including stadium, gymnasium, natatorium, tennis court, etc. Wutaishan Sports Center was established in 1952 and it was one of the oldest and most advanced stadiums in early time of People's Republic of China.",Nanjing
705,"In 2005, in order to host The 10th National Game of People's Republic of China, there was a new stadium, Nanjing Olympic Sports Center, constructed in Nanjing. Compared to Wutaishan Sports Center, which the major stadium's capacity is 18,500, Nanjing Olympic Sports Center has a more advanced stadium which is big enough to seat 60,000 spectators. Its gymnasium has capacity of 13,000, and natatorium of capacity 3,000.",Nanjing
706,"On 10 February 2010, the 122nd IOC session at Vancouver announced Nanjing as the host city for the 2nd Summer Youth Olympic Games. The slogan of the 2014 Youth Olympic Games was “Share the Games, Share our Dreams”. The Nanjing 2014 Youth Olympic Games featured all 28 sports on the Olympic programme and were held from 16 to 28 August. The Nanjing Youth Olympic Games Organising Committee (NYOGOC) worked together with the International Olympic Committee (IOC) to attract the best young athletes from around the world to compete at the highest level. Off the competition fields, an integrated culture and education programme focused on discussions about education, Olympic values, social challenges, and cultural diversity. The YOG aims to spread the Olympic spirit and encourage sports participation.",Nanjing
707,"Nanjing is one of the most beautiful cities of mainland China with lush green parks, natural scenic lakes, small mountains, historical buildings and monuments, relics and much more, which attracts thousands of tourists every year.",Nanjing
708,"Because it was designated as the national capital, many structures were built around that time. Even today, some of them still remain which are open to tourists.",Nanjing
709,"Nanjing has been the educational centre in southern China for more than 1700 years. There are 75 institutions of higher learning till 2013. The number of National key laboratories, National key disciplines and the academicians of Chinese Academy of Sciences and Chinese Academy of Engineering all rank third in the nation. It boasts some of the most prominent educational institutions in the region, some of which are listed as follows:",Nanjing
710,"The term dialect (from Latin dialectus, dialectos, from the ancient Greek word διάλεκτος diálektos, ""discourse"", from διά diá, ""through"" and λέγω legō, ""I speak"") is used in two distinct ways to refer to two different types of linguistic phenomena.",Dialect
711,"One usage—the more common among linguists—refers to a variety of a language that is a characteristic of a particular group of the language's speakers. The term is applied most often to regional speech patterns, but a dialect may also be defined by other factors, such as social class. A dialect that is associated with a particular social class can be termed a sociolect, a dialect that is associated with a particular ethnic group can be termed as ethnolect, and a regional dialect may be termed a regiolect. According to this definition, any variety of a language constitutes ""a dialect"", including any standard varieties.",Dialect
712,"The other usage refers to a language that is socially subordinated to a regional or national standard language, often historically cognate or related to the standard language, but not actually derived from it. In this sense, unlike in the first usage, the standard language would not itself be considered a ""dialect,"" as it is the dominant language in a particular state or region, whether in terms of social or political status, official status, predominance or prevalence, or all of the above. Meanwhile, the ""dialects"" subordinate to the standard language are generally not variations on the standard language but rather separate (but often related) languages in and of themselves. For example, most of the various regional Romance languages of Italy, often colloquially referred to as Italian ""dialects,"" are, in fact, not actually derived from modern standard Italian, but rather evolved from Vulgar Latin separately and individually from one another and independently of standard Italian, long prior to the diffusion of a national standardized language throughout what is now Italy. These various Latin-derived regional languages are therefore, in a linguistic sense, not truly ""dialects"" of the standard Italian language, but are instead better defined as their own separate languages. Conversely, with the spread of standard Italian throughout Italy in the 20th century, various regional versions or varieties of standard Italian developed, generally as a mix of the national standard Italian with local regional languages and local accents. These variations on standard Italian, known as regional Italian, would more appropriately be called ""dialects"" in accordance with the first linguistic definition of ""dialect,"" as they are in fact derived partially or mostly from standard Italian. ",Dialect
713,"A dialect is distinguished by its vocabulary, grammar, and pronunciation (phonology, including prosody). Where a distinction can be made only in terms of pronunciation (including prosody, or just prosody itself), the term accent may be preferred over dialect. Other types of speech varieties include jargons, which are characterized by differences in lexicon (vocabulary); slang; patois; pidgins; and argots.",Dialect
714,"A standard dialect (also known as a standardized dialect or ""standard language"") is a dialect that is supported by institutions. Such institutional support may include government recognition or designation; presentation as being the ""correct"" form of a language in schools; published grammars, dictionaries, and textbooks that set forth a correct spoken and written form; and an extensive formal literature that employs that dialect (prose, poetry, non-fiction, etc.). There may be multiple standard dialects associated with a single language. For example, Standard American English, Standard British English, Standard Canadian English, Standard Indian English, Standard Australian English, and Standard Philippine English may all be said to be standard dialects of the English language.",Dialect
715,"A nonstandard dialect, like a standard dialect, has a complete vocabulary, grammar, and syntax, but is usually not the beneficiary of institutional support. Examples of a nonstandard English dialect are Southern American English, Western Australian English, Scouse and Tyke. The Dialect Test was designed by Joseph Wright to compare different English dialects with each other.",Dialect
716,"There is no universally accepted criterion for distinguishing two different languages from two dialects (i.e. varieties) of the same language. A number of rough measures exist, sometimes leading to contradictory results. The distinction is therefore subjective and depends on the user's frame of reference. For example, there is discussion about if the Limón Creole English must be considered as ""a kind"" of English or a different language. This creole is spoken in the Caribbean coast of Costa Rica (Central America) by descendant of Jamaican people. The position that Costa Rican linguists support depends on the University they belong.",Dialect
